{"chunker_version":"chunker-v1","dataset_hash":"5561bee58e37cd8d86b756f17e6c1a6ebed32ba54ba2ac48f4cd4adee254db7e","dataset_version":"v1","entries":[{"chunk_ids":["44ff7c6c-f28f-4b39-9f7b-a0206b9b4317"],"gold_id":"pc-0001-g1","reason":null,"status":"mapped"},{"chunk_ids":["44ff7c6c-f28f-4b39-9f7b-a0206b9b4317"],"gold_id":"pc-0002-g1","reason":null,"status":"mapped"},{"chunk_ids":["44ff7c6c-f28f-4b39-9f7b-a0206b9b4317"],"gold_id":"pc-0003-g1","reason":null,"status":"mapped"},{"chunk_ids":["ec106839-f05b-42c9-8c3f-f7e782f216b6"],"gold_id":"pc-0004-g1","reason":null,"status":"mapped"},{"chunk_ids":["ec106839-f05b-42c9-8c3f-f7e782f216b6"],"gold_id":"pc-0005-g1","reason":null,"status":"mapped"},{"chunk_ids":["aa5fac45-633e-47e2-8cc5-7a15550ba55f"],"gold_id":"pc-0006-g1","reason":null,"status":"mapped"},{"chunk_ids":["64ff08b9-a07b-4a3a-b943-bf1b75362bfe"],"gold_id":"pc-0007-g1","reason":null,"status":"mapped"},{"chunk_ids":["632eacde-4522-4c4f-a34b-d24dfe18e190"],"gold_id":"pc-0008-g1","reason":null,"status":"mapped"},{"chunk_ids":["b2aaf374-b50b-4db6-bb77-fa126de17629"],"gold_id":"pc-0009-g1","reason":null,"status":"mapped"},{"chunk_ids":["a45f7856-fa67-41f2-a40b-49999170957a"],"gold_id":"pc-0010-g1","reason":null,"status":"mapped"},{"chunk_ids":["745f0a0c-642a-4182-a228-07623f5e94bd"],"gold_id":"pc-0011-g1","reason":null,"status":"mapped"},{"chunk_ids":["3935415f-f1e7-4857-9095-ff21d3708504"],"gold_id":"pc-0012-g1","reason":null,"status":"mapped"},{"chunk_ids":["e42deb6a-f522-4d99-9663-c2feb3f2d262"],"gold_id":"pc-0013-g1","reason":null,"status":"mapped"},{"chunk_ids":["e42deb6a-f522-4d99-9663-c2feb3f2d262"],"gold_id":"pc-0014-g1","reason":null,"status":"mapped"},{"chunk_ids":["e42deb6a-f522-4d99-9663-c2feb3f2d262"],"gold_id":"pc-0015-g1","reason":null,"status":"mapped"},{"chunk_ids":["e3d3a6fa-cf9e-419d-b3ed-ae8a07cb56fd"],"gold_id":"pc-0016-g1","reason":null,"status":"mapped"},{"chunk_ids":["e3d3a6fa-cf9e-419d-b3ed-ae8a07cb56fd"],"gold_id":"pc-0017-g1","reason":null,"status":"mapped"},{"chunk_ids":["5e7582ab-38bc-4983-a589-22050fa04244"],"gold_id":"pc-0018-g1","reason":null,"status":"mapped"},{"chunk_ids":["85ff7f98-3662-4b71-bdd3-2696dacb5a7f"],"gold_id":"pc-0019-g1","reason":null,"status":"mapped"},{"chunk_ids":["85ff7f98-3662-4b71-bdd3-2696dacb5a7f"],"gold_id":"pc-0020-g1","reason":null,"status":"mapped"},{"chunk_ids":["85ff7f98-3662-4b71-bdd3-2696dacb5a7f"],"gold_id":"pc-0021-g1","reason":null,"status":"mapped"},{"chunk_ids":["85ff7f98-3662-4b71-bdd3-2696dacb5a7f"],"gold_id":"pc-0022-g1","reason":null,"status":"mapped"},{"chunk_ids":["87d8fce1-e69c-40ed-8fe6-6e8f39ddf22b"],"gold_id":"pc-0023-g1","reason":null,"status":"mapped"},{"chunk_ids":["49664453-1464-4115-9b96-bb3fce398b94"],"gold_id":"pc-0024-g1","reason":null,"status":"mapped"},{"chunk_ids":["66ee1f19-fce0-4db5-8fa7-3b11575b766a"],"gold_id":"pc-0025-g1","reason":null,"status":"mapped"},{"chunk_ids":["66ee1f19-fce0-4db5-8fa7-3b11575b766a"],"gold_id":"pc-0026-g1","reason":null,"status":"mapped"},{"chunk_ids":["2516d4cc-97d4-4b3d-8f2a-faaab949b2cf"],"gold_id":"pc-0027-g1","reason":null,"status":"mapped"},{"chunk_ids":["507ec879-34f1-49dc-a196-4d9e8b0f3bec"],"gold_id":"pc-0028-g1","reason":null,"status":"mapped"},{"chunk_ids":["3d9ee8da-747a-49e5-90b6-89cf471af56d"],"gold_id":"pc-0029-g1","reason":null,"status":"mapped"},{"chunk_ids":["3c15dea6-fb25-4136-b632-6d8a760dfcd1"],"gold_id":"pc-0030-g1","reason":null,"status":"mapped"},{"chunk_ids":["07787aa1-6f68-4994-81c0-231062dc45b1"],"gold_id":"pc-0031-g1","reason":null,"status":"mapped"},{"chunk_ids":["ea070e93-eec4-4aee-a59e-b5dbe4481ce7"],"gold_id":"pc-0032-g1","reason":null,"status":"mapped"},{"chunk_ids":["ea070e93-eec4-4aee-a59e-b5dbe4481ce7"],"gold_id":"pc-0033-g1","reason":null,"status":"mapped"},{"chunk_ids":["af6707df-9e4b-43ca-a8f7-e4c2ad4a636b"],"gold_id":"pc-0034-g1","reason":null,"status":"mapped"},{"chunk_ids":["6d6a8c41-769b-4406-84ca-60bf9b6cc435"],"gold_id":"pc-0035-g1","reason":null,"status":"mapped"},{"chunk_ids":["eb8bbb59-f805-4cf9-bca0-a8641d207e91"],"gold_id":"pc-0036-g1","reason":null,"status":"mapped"},{"chunk_ids":["1e235abd-5c89-424a-aebf-dd3a19bee93f"],"gold_id":"pc-0037-g1","reason":null,"status":"mapped"},{"chunk_ids":["e9bc88a0-ceca-456e-8b5b-7a9ae00a33ed"],"gold_id":"pc-0038-g1","reason":null,"status":"mapped"},{"chunk_ids":["839bb918-3d7a-4813-bd34-3b606fbeece5"],"gold_id":"pc-0039-g1","reason":null,"status":"mapped"},{"chunk_ids":["6eb5e7bb-01a8-48b3-984a-5cdaf3c428b6"],"gold_id":"pc-0040-g1","reason":null,"status":"mapped"},{"chunk_ids":["0bddc9d1-0a90-4255-bc0d-46f2ec9dc317"],"gold_id":"pc-0041-g1","reason":null,"status":"mapped"},{"chunk_ids":["9b56ba4b-4a0e-4c70-ace4-8739bc5b7c69"],"gold_id":"pc-0042-g1","reason":null,"status":"mapped"},{"chunk_ids":["737124a5-8ec2-4981-b4ad-9d8ad01b73e5"],"gold_id":"pc-0043-g1","reason":null,"status":"mapped"},{"chunk_ids":["3b386feb-dcfe-4a19-acc1-331eeee02846"],"gold_id":"pc-0044-g1","reason":null,"status":"mapped"},{"chunk_ids":["1fd0955b-4ee1-44dd-8e6d-3733703da9b4"],"gold_id":"pc-0045-g1","reason":null,"status":"mapped"},{"chunk_ids":["10652018-bb85-4485-874d-1b495f6d76bd"],"gold_id":"pc-0046-g1","reason":null,"status":"mapped"},{"chunk_ids":["1fd0955b-4ee1-44dd-8e6d-3733703da9b4"],"gold_id":"pc-0047-g1","reason":null,"status":"mapped"},{"chunk_ids":["e976f4f7-325f-4e76-a00d-fa3fd69c59d3"],"gold_id":"pc-0048-g1","reason":null,"status":"mapped"},{"chunk_ids":["9a52863c-97dd-460c-be82-b3b48391f383"],"gold_id":"pc-0049-g1","reason":null,"status":"mapped"},{"chunk_ids":["b8a12443-bd2c-4103-89ac-e9c6b61c5621"],"gold_id":"pc-0050-g1","reason":null,"status":"mapped"},{"chunk_ids":["b75cdfe0-63a4-48ec-9909-6a35bad6956b"],"gold_id":"pc-0051-g1","reason":null,"status":"mapped"},{"chunk_ids":["fbbbbfad-b92d-43fe-b40e-ef7840e51a6b"],"gold_id":"pc-0052-g1","reason":null,"status":"mapped"},{"chunk_ids":["c008cee2-afec-4d18-85e3-1b3841b291f2"],"gold_id":"pc-0053-g1","reason":null,"status":"mapped"},{"chunk_ids":["f746b8f8-f72f-4a0e-aace-f5eedf91138a"],"gold_id":"pc-0054-g1","reason":null,"status":"mapped"},{"chunk_ids":["f746b8f8-f72f-4a0e-aace-f5eedf91138a"],"gold_id":"pc-0055-g1","reason":null,"status":"mapped"},{"chunk_ids":[],"gold_id":"pc-0056-g1","reason":"No single same-source/version/page chunk span covers the unique key interval; counts as a miss.","status":"unmappable"},{"chunk_ids":["3cec732d-988b-4370-8cc3-4093985ee100"],"gold_id":"pc-0057-g1","reason":null,"status":"mapped"},{"chunk_ids":["adb4a3c1-8d14-40e6-9461-3453f21e28f5"],"gold_id":"pc-0058-g1","reason":null,"status":"mapped"},{"chunk_ids":["21f5c443-8b61-482d-a1fa-7d566a4395b2"],"gold_id":"pc-0059-g1","reason":null,"status":"mapped"},{"chunk_ids":["f2e3c9c6-386b-42f2-a022-4346893710ab"],"gold_id":"pc-0060-g1","reason":null,"status":"mapped"},{"chunk_ids":["6f6cd3f4-fe86-48ba-bf6b-64be1d7c546b"],"gold_id":"pc-0061-g1","reason":null,"status":"mapped"},{"chunk_ids":["60292ac3-dc9c-4e3b-896e-f0a3d5312ab8"],"gold_id":"pc-0062-g1","reason":null,"status":"mapped"},{"chunk_ids":["2fabc316-cf81-4ca7-beb4-5781c78d3c51"],"gold_id":"pc-0063-g1","reason":null,"status":"mapped"},{"chunk_ids":["c02c0981-8668-400c-aafd-93d9cf1ccf0a"],"gold_id":"pc-0064-g1","reason":null,"status":"mapped"},{"chunk_ids":["862daf44-0a79-4a0d-8bc9-95975802cc3b"],"gold_id":"pc-0065-g1","reason":null,"status":"mapped"},{"chunk_ids":["2f7e1816-1c5d-48b8-a6f2-719e6db150b1"],"gold_id":"pc-0066-g1","reason":null,"status":"mapped"},{"chunk_ids":["e78a5df5-425a-4b3b-974f-e83606cd41c8"],"gold_id":"pc-0067-g1","reason":null,"status":"mapped"},{"chunk_ids":["283d404d-5f90-4950-8c8f-9852897900a9"],"gold_id":"pc-0068-g1","reason":null,"status":"mapped"},{"chunk_ids":["7d0085fb-192d-454e-9937-fe06af2cb727"],"gold_id":"pc-0069-g1","reason":null,"status":"mapped"},{"chunk_ids":["e770f909-3f00-496a-956d-f5f07cc05269"],"gold_id":"pc-0070-g1","reason":null,"status":"mapped"},{"chunk_ids":["55220bfd-959f-4ebc-90ef-5175c4c1a073"],"gold_id":"pc-0071-g1","reason":null,"status":"mapped"},{"chunk_ids":[],"gold_id":"pc-0072-g1","reason":"No single same-source/version/page chunk span covers the unique key interval; counts as a miss.","status":"unmappable"},{"chunk_ids":["2486e543-6c19-4d4b-820f-a236dfc1e4a0"],"gold_id":"pc-0073-g1","reason":null,"status":"mapped"},{"chunk_ids":["d784b6c0-cc5b-4fa8-9cee-071fd75d465a"],"gold_id":"pc-0074-g1","reason":null,"status":"mapped"},{"chunk_ids":["a05893f0-db50-4675-97bd-578c4286cc5c"],"gold_id":"pc-0075-g1","reason":null,"status":"mapped"}],"extraction":{"extractor":"pypdf","extractor_version":"6.18.1","params_hash":"7c3f1766ee925cd0175429abce29a029d834b8be9ffa33f45813e3a4944f6b8d"},"generated_at":"2026-09-19T14:38:21+00:00","generator":"medops.evals.probe.chunk_mapping/v1","normalization":"norm-v1"}
