{"chunker_version":"chunker-v1","dataset_hash":"5561bee58e37cd8d86b756f17e6c1a6ebed32ba54ba2ac48f4cd4adee254db7e","dataset_version":"v1","entries":[{"chunk_ids":["d4a3040e-82f6-4543-a123-b2ea2a3e8804"],"gold_id":"pc-0001-g1","reason":null,"status":"mapped"},{"chunk_ids":["d4a3040e-82f6-4543-a123-b2ea2a3e8804"],"gold_id":"pc-0002-g1","reason":null,"status":"mapped"},{"chunk_ids":["d4a3040e-82f6-4543-a123-b2ea2a3e8804"],"gold_id":"pc-0003-g1","reason":null,"status":"mapped"},{"chunk_ids":["51d18927-5fb4-4194-a166-5a1df8686045"],"gold_id":"pc-0004-g1","reason":null,"status":"mapped"},{"chunk_ids":["51d18927-5fb4-4194-a166-5a1df8686045"],"gold_id":"pc-0005-g1","reason":null,"status":"mapped"},{"chunk_ids":["65249737-75d8-4936-b8ba-4d87a795a93d"],"gold_id":"pc-0006-g1","reason":null,"status":"mapped"},{"chunk_ids":["cf218f18-6abd-4060-840e-31cd23c85164"],"gold_id":"pc-0007-g1","reason":null,"status":"mapped"},{"chunk_ids":["747814fe-0e56-4bae-bed7-2377a4ed4a5b"],"gold_id":"pc-0008-g1","reason":null,"status":"mapped"},{"chunk_ids":["d55d033e-e7bc-43b0-a8b6-d01fbd85bbbe"],"gold_id":"pc-0009-g1","reason":null,"status":"mapped"},{"chunk_ids":["2837455e-6c46-48aa-a844-4f3b43f2e681"],"gold_id":"pc-0010-g1","reason":null,"status":"mapped"},{"chunk_ids":["c55ae8d0-efe2-4c75-b9d1-e04280cb4922"],"gold_id":"pc-0011-g1","reason":null,"status":"mapped"},{"chunk_ids":["699c4f5d-b69d-4c71-b94e-126f4971eb5a"],"gold_id":"pc-0012-g1","reason":null,"status":"mapped"},{"chunk_ids":["907cf1bf-758c-47c6-8605-e0a514b0c6f6"],"gold_id":"pc-0013-g1","reason":null,"status":"mapped"},{"chunk_ids":["907cf1bf-758c-47c6-8605-e0a514b0c6f6"],"gold_id":"pc-0014-g1","reason":null,"status":"mapped"},{"chunk_ids":["907cf1bf-758c-47c6-8605-e0a514b0c6f6"],"gold_id":"pc-0015-g1","reason":null,"status":"mapped"},{"chunk_ids":["d40c40fb-8b06-4384-9731-fd8671eb78cf"],"gold_id":"pc-0016-g1","reason":null,"status":"mapped"},{"chunk_ids":["d40c40fb-8b06-4384-9731-fd8671eb78cf"],"gold_id":"pc-0017-g1","reason":null,"status":"mapped"},{"chunk_ids":["8e124452-1933-4889-8dbb-a1788bd2bb15"],"gold_id":"pc-0018-g1","reason":null,"status":"mapped"},{"chunk_ids":["85ad13f3-051d-4bbb-91ab-cb1e4f88f919"],"gold_id":"pc-0019-g1","reason":null,"status":"mapped"},{"chunk_ids":["85ad13f3-051d-4bbb-91ab-cb1e4f88f919"],"gold_id":"pc-0020-g1","reason":null,"status":"mapped"},{"chunk_ids":["85ad13f3-051d-4bbb-91ab-cb1e4f88f919"],"gold_id":"pc-0021-g1","reason":null,"status":"mapped"},{"chunk_ids":["85ad13f3-051d-4bbb-91ab-cb1e4f88f919"],"gold_id":"pc-0022-g1","reason":null,"status":"mapped"},{"chunk_ids":["584fdfac-405e-4ff2-9235-e920e97c184a"],"gold_id":"pc-0023-g1","reason":null,"status":"mapped"},{"chunk_ids":["c0614f72-ac75-4982-b01e-8d3f678604a4"],"gold_id":"pc-0024-g1","reason":null,"status":"mapped"},{"chunk_ids":["55f17c4b-1251-400f-af37-18a4c189e113"],"gold_id":"pc-0025-g1","reason":null,"status":"mapped"},{"chunk_ids":["55f17c4b-1251-400f-af37-18a4c189e113"],"gold_id":"pc-0026-g1","reason":null,"status":"mapped"},{"chunk_ids":["1435bb03-9ab8-4ed2-9c8a-decab75053a9"],"gold_id":"pc-0027-g1","reason":null,"status":"mapped"},{"chunk_ids":["271253ed-017f-48b5-b75d-fb0bf6101fd3"],"gold_id":"pc-0028-g1","reason":null,"status":"mapped"},{"chunk_ids":["aa6f443b-aa4f-4c67-8bf8-2c54d803d3f5"],"gold_id":"pc-0029-g1","reason":null,"status":"mapped"},{"chunk_ids":["778b7aaa-7b2d-4939-a705-cd7588ab7737"],"gold_id":"pc-0030-g1","reason":null,"status":"mapped"},{"chunk_ids":["c7d89ab8-e58e-4573-b754-3d1e7e09a822"],"gold_id":"pc-0031-g1","reason":null,"status":"mapped"},{"chunk_ids":["892c5995-4afb-4929-bc97-76e1ce6e0b9a"],"gold_id":"pc-0032-g1","reason":null,"status":"mapped"},{"chunk_ids":["892c5995-4afb-4929-bc97-76e1ce6e0b9a"],"gold_id":"pc-0033-g1","reason":null,"status":"mapped"},{"chunk_ids":["bd6b2d9e-21d0-4ec3-82ba-9f6d107817e0"],"gold_id":"pc-0034-g1","reason":null,"status":"mapped"},{"chunk_ids":["17d8fb6f-991e-484c-b4f4-4185938be56f"],"gold_id":"pc-0035-g1","reason":null,"status":"mapped"},{"chunk_ids":["73e8b857-a5fc-48ef-ac55-faa15ddcfb9a"],"gold_id":"pc-0036-g1","reason":null,"status":"mapped"},{"chunk_ids":["211da9d2-3e95-4265-a6a5-f18e2cee4252"],"gold_id":"pc-0037-g1","reason":null,"status":"mapped"},{"chunk_ids":["a07021fb-e6ff-4b49-88b0-15ca9d09e4ba"],"gold_id":"pc-0038-g1","reason":null,"status":"mapped"},{"chunk_ids":["44286327-66a4-4260-b6f9-2fce8e53e664"],"gold_id":"pc-0039-g1","reason":null,"status":"mapped"},{"chunk_ids":["d3cd7063-dc07-4b12-a956-437ce4a2babb"],"gold_id":"pc-0040-g1","reason":null,"status":"mapped"},{"chunk_ids":["f60ec7d7-67be-4c11-b0bf-e8e081898ff5"],"gold_id":"pc-0041-g1","reason":null,"status":"mapped"},{"chunk_ids":["c92b2926-0e0e-437b-9fa3-3d09ddabec3f"],"gold_id":"pc-0042-g1","reason":null,"status":"mapped"},{"chunk_ids":["28e577a1-94e4-41d0-9f69-2b19e6f7b31c"],"gold_id":"pc-0043-g1","reason":null,"status":"mapped"},{"chunk_ids":["566f5bd3-6c9a-4bfe-ba85-3cea67f01c82"],"gold_id":"pc-0044-g1","reason":null,"status":"mapped"},{"chunk_ids":["c1635bb9-4d2a-4ca2-a1ec-30186e1db041"],"gold_id":"pc-0045-g1","reason":null,"status":"mapped"},{"chunk_ids":["f008c7b6-e2e4-4836-8890-a0dc06667e5b"],"gold_id":"pc-0046-g1","reason":null,"status":"mapped"},{"chunk_ids":["c1635bb9-4d2a-4ca2-a1ec-30186e1db041"],"gold_id":"pc-0047-g1","reason":null,"status":"mapped"},{"chunk_ids":["19a56713-2cc5-4544-baee-6e973c0225f5"],"gold_id":"pc-0048-g1","reason":null,"status":"mapped"},{"chunk_ids":["2553a268-b8ae-436c-b344-89ce11c67368"],"gold_id":"pc-0049-g1","reason":null,"status":"mapped"},{"chunk_ids":["fee00384-937e-48ce-853e-dd93317bc748"],"gold_id":"pc-0050-g1","reason":null,"status":"mapped"},{"chunk_ids":["1fe3d73e-df5c-4470-a1d4-422f5270f533"],"gold_id":"pc-0051-g1","reason":null,"status":"mapped"},{"chunk_ids":["a32e2eda-4eae-4f38-9bad-a1ac16ed982f"],"gold_id":"pc-0052-g1","reason":null,"status":"mapped"},{"chunk_ids":["38a20122-25d1-4dcb-9ef5-5876f805ac46"],"gold_id":"pc-0053-g1","reason":null,"status":"mapped"},{"chunk_ids":["93b5d4e5-52bf-4170-896b-6d560c0ddbdb"],"gold_id":"pc-0054-g1","reason":null,"status":"mapped"},{"chunk_ids":["93b5d4e5-52bf-4170-896b-6d560c0ddbdb"],"gold_id":"pc-0055-g1","reason":null,"status":"mapped"},{"chunk_ids":[],"gold_id":"pc-0056-g1","reason":"No single same-source/version/page chunk span covers the unique key interval; counts as a miss.","status":"unmappable"},{"chunk_ids":["a96aab63-bd6d-493c-9fd0-2fdf92005888"],"gold_id":"pc-0057-g1","reason":null,"status":"mapped"},{"chunk_ids":["5b4d1a20-abcc-4ebc-8b1e-b6dbff1861eb"],"gold_id":"pc-0058-g1","reason":null,"status":"mapped"},{"chunk_ids":["f3e2936c-a35c-41b8-ba65-d90af64d7bea"],"gold_id":"pc-0059-g1","reason":null,"status":"mapped"},{"chunk_ids":["827f8635-8e5f-40bf-82f1-4c32b6e0dfe3"],"gold_id":"pc-0060-g1","reason":null,"status":"mapped"},{"chunk_ids":["2e4b1385-bb64-4f27-8d05-51a76ad50a5f"],"gold_id":"pc-0061-g1","reason":null,"status":"mapped"},{"chunk_ids":["254734fa-5027-46d3-950e-f138d310ff03"],"gold_id":"pc-0062-g1","reason":null,"status":"mapped"},{"chunk_ids":["9dddd951-0d2e-48af-8d8f-5e5ef03ef1c9"],"gold_id":"pc-0063-g1","reason":null,"status":"mapped"},{"chunk_ids":["737b1a71-3188-4696-958f-acf70b16da84"],"gold_id":"pc-0064-g1","reason":null,"status":"mapped"},{"chunk_ids":["d85869c3-907b-4de2-ba3c-0327d6a7c80e"],"gold_id":"pc-0065-g1","reason":null,"status":"mapped"},{"chunk_ids":["38a13b57-2ef0-492e-870a-51b0de0279e9"],"gold_id":"pc-0066-g1","reason":null,"status":"mapped"},{"chunk_ids":["40a18d1d-7e34-4526-be4f-9a7b088632c6"],"gold_id":"pc-0067-g1","reason":null,"status":"mapped"},{"chunk_ids":["5ddec6c8-426b-44a6-b4de-f415434837e5"],"gold_id":"pc-0068-g1","reason":null,"status":"mapped"},{"chunk_ids":["886dcb64-e741-4ea5-8f26-66b15452e94d"],"gold_id":"pc-0069-g1","reason":null,"status":"mapped"},{"chunk_ids":["a9a0e188-8e0d-43b7-bf48-d99bb707128f"],"gold_id":"pc-0070-g1","reason":null,"status":"mapped"},{"chunk_ids":["4c3dda91-a5d7-4ea9-b465-f435ae8f7ade"],"gold_id":"pc-0071-g1","reason":null,"status":"mapped"},{"chunk_ids":[],"gold_id":"pc-0072-g1","reason":"No single same-source/version/page chunk span covers the unique key interval; counts as a miss.","status":"unmappable"},{"chunk_ids":["24d2c6a0-f184-45f7-b957-f9a4832b8071"],"gold_id":"pc-0073-g1","reason":null,"status":"mapped"},{"chunk_ids":["b0d07221-9533-4a5a-86bb-cf68ee37ebad"],"gold_id":"pc-0074-g1","reason":null,"status":"mapped"},{"chunk_ids":["c7b85fd9-bb25-4ea0-905b-8a4a1f62fdd0"],"gold_id":"pc-0075-g1","reason":null,"status":"mapped"}],"extraction":{"extractor":"pypdf","extractor_version":"6.18.1","params_hash":"7c3f1766ee925cd0175429abce29a029d834b8be9ffa33f45813e3a4944f6b8d"},"generated_at":"2026-09-20T02:15:29+00:00","generator":"medops.evals.probe.chunk_mapping/v1","normalization":"norm-v1"}
